{
  "$schema": "https://json-schema.org/draft/2020-12/schema",
  "$id": "urn:project-gateway:schema:lifecycle:1.0:records:approval-record",
  "title": "ApprovalRecord",
  "type": "object",
  "required": [
    "record_type",
    "record_id",
    "created_at",
    "responsible_role",
    "registry_snapshot_reference",
    "subject",
    "workspace_id",
    "purpose",
    "validation_record_ids",
    "required_semantics",
    "valid_until"
  ],
  "properties": {
    "record_type": {
      "const": "ApprovalRecord"
    },
    "record_id": {
      "$ref": "urn:project-gateway:schema:artifact:1.0:common:identifiers#/$defs/lifecycleRecordId"
    },
    "created_at": {
      "$ref": "urn:project-gateway:schema:artifact:1.0:common:identifiers#/$defs/timestamp"
    },
    "responsible_role": {
      "const": "trusted-approver"
    },
    "registry_snapshot_reference": {
      "$ref": "urn:project-gateway:schema:registry:1.0:registry-snapshot-reference"
    },
    "subject": {
      "allOf": [
        {
          "$ref": "urn:project-gateway:schema:lifecycle:1.0:common:components#/$defs/exactArtifactSubject"
        },
        {
          "properties": {
            "kind": {
              "properties": {
                "id": {
                  "enum": [
                    "TaskSpec",
                    "AuthorityPolicy",
                    "ContextManifest",
                    "CompletionContract",
                    "ExecutionBundle"
                  ]
                }
              }
            }
          }
        }
      ]
    },
    "workspace_id": {
      "$ref": "urn:project-gateway:schema:artifact:1.0:common:identifiers#/$defs/workspaceId"
    },
    "purpose": {
      "enum": [
        "execution-use"
      ]
    },
    "validation_record_ids": {
      "type": "array",
      "minItems": 1,
      "maxItems": 16,
      "uniqueItems": true,
      "items": {
        "$ref": "urn:project-gateway:schema:artifact:1.0:common:identifiers#/$defs/lifecycleRecordId"
      }
    },
    "required_semantics": {
      "$ref": "urn:project-gateway:schema:artifact:1.0:common:requirements"
    },
    "valid_until": {
      "oneOf": [
        {
          "type": "null"
        },
        {
          "$ref": "urn:project-gateway:schema:artifact:1.0:common:identifiers#/$defs/timestamp"
        }
      ]
    }
  },
  "unevaluatedProperties": false
}
