{
  "record_type": "ApprovalRecord",
  "record_id": "pgw:l:0e8cc53e2cd90eff0ede290ba5e2a81b",
  "created_at": "2026-08-04T06:01:00.000Z",
  "responsible_role": "trusted-approver",
  "registry_snapshot_reference": {
    "registry_protocol_id": "project-gateway.registry",
    "registry_snapshot_format_version": "1.0",
    "registry_snapshot_id": "pgw:g:3fb51a11f2b23ba8c171326cbba7eb64",
    "registry_snapshot_digest": "sha-256:613112612ee7803db00c6e51826b3a63ee6ce6732b17c9b09ae8aff00db47c05",
    "protocol_compatibility": {
      "mode": "exact-release",
      "artifact_protocol_id": "project-gateway.artifact",
      "artifact_protocol_version": "1.0"
    }
  },
  "subject": {
    "protocol_version": "1.0",
    "kind": {
      "id": "CompletionContract",
      "version": "1.0"
    },
    "instance_id": "pgw:i:23c04d055bd59c637bd47e3feb5b5575",
    "revision_id": "pgw:r:ff793e8e7ff0f02133a9af257b81003f",
    "digest": "sha-256:3eb28e975843c943d894fb1d751f0a234b41deb72c38e443aeff62682b9285c7",
    "workspace_id": "pgw:w:cf4339b1f56441936467dea1357dc30e"
  },
  "workspace_id": "pgw:w:cf4339b1f56441936467dea1357dc30e",
  "purpose": "execution-use",
  "validation_record_ids": [
    "pgw:l:66aa12fe9129d5c513dfdf53b6ee3a15"
  ],
  "required_semantics": {
    "protocol_features": [],
    "consumer_capabilities": []
  },
  "valid_until": null
}
